{
  "$schema": "https://json-schema.org/draft/2020-12/schema",
  "$id": "https://acef.ai/schemas/v1.1/incident_card.schema.json",
  "title": "ACEF Incident Card Payload (public projection of incident_report)",
  "description": "Payload schema for the public incident_card record (RFC-0002 Appendix B; ACEF core_version 1.1.0). The public projection of an incident_report, generated under the §5.11 publishability map. Closed (additionalProperties: false); unknown keys MUST be x-*-namespaced elsewhere in the envelope to be safely ignorable. The frozen incident_report (acef-conventions/v1/) is unchanged. The harm_class enum, taxonomy_crosswalk member subschemas, coordinated_disclosure shape, and severity_vector grammar are referenced from companion v1.1 schemas, not inlined.",
  "type": "object",
  "required": [
    "public_incident_id",
    "id_grade",
    "harm_core"
  ],
  "properties": {
    "public_incident_id": {
      "type": "string",
      "pattern": "^AIIC-[A-Z0-9]{2,8}-[0-9]{4}-[0-9A-HJKMNP-TV-Z]{26,}$",
      "description": "Assigner-scoped, non-enumerable, self-asserted federated handle of the form AIIC-{assigner}-{year}-{suffix}: assigner is 2-8 uppercase alphanumerics, year is 4 digits, and the suffix is >=26 Crockford-base32 chars [0-9A-HJKMNP-TV-Z] (>=128 bits of entropy). Lifecycle state (supersedes/merged_from/split_into) is held out-of-band in the §5.3 id-state document. The handle is self-asserted, NOT a forgery-resistant credential: offline-deterministic validation checks pattern + JWS self-consistency only and never attributes the id to the assigner domain. Carries id_grade (§5.3)."
    },
    "id_grade": {
      "type": "string",
      "const": "self-asserted",
      "description": "Trust grade of public_incident_id (§5.3). Pinned to 'self-asserted' on the v1.1 schema surface; 'registry-canonical' is reserved for the v1.2 schema surface (§11) and is therefore rejected here, matching the v1.1 validator (§5.3, §6)."
    },
    "severity": {
      "type": "string",
      "enum": [
        "critical",
        "major",
        "minor",
        "informational"
      ],
      "description": "Coarse rating; MUST equal band(severity_vector) when the vector is present (§5.4; ACEF-088)."
    },
    "harm_core": {
      "type": "object",
      "required": [
        "realization",
        "causality",
        "harm_class"
      ],
      "additionalProperties": false,
      "description": "Cross-taxonomy harm core (§5.2). realization, causality, and harm_class are closed enums; harm_class is keyed to Art.3(49)(a-d) via the harm-core-taxonomy companion schema.",
      "properties": {
        "realization": {
          "type": "string",
          "enum": [
            "harm_event",
            "harm_issue",
            "near_miss"
          ]
        },
        "causality": {
          "type": "object",
          "additionalProperties": false,
          "required": [
            "entity",
            "intent",
            "timing"
          ],
          "properties": {
            "entity": {
              "type": "string",
              "enum": [
                "human",
                "ai",
                "other"
              ]
            },
            "intent": {
              "type": "string",
              "enum": [
                "intentional",
                "unintentional",
                "other"
              ]
            },
            "timing": {
              "type": "string",
              "enum": [
                "pre_deployment",
                "post_deployment",
                "other"
              ]
            }
          }
        },
        "harm_class": {
          "$ref": "harm-core-taxonomy.json#/$defs/harm_class"
        },
        "tangibility": {
          "type": "string",
          "enum": [
            "tangible",
            "intangible"
          ]
        }
      }
    },
    "value_chain_role": {
      "type": "string",
      "enum": [
        "foundation_model",
        "fine_tuned_model",
        "integrated_application",
        "third_party_component"
      ]
    },
    "autonomy_level": {
      "type": "string",
      "enum": [
        "autonomous",
        "human_on_the_loop",
        "human_in_the_loop"
      ]
    },
    "incident_dedupe_key": {
      "type": "string",
      "pattern": "^sha256:[0-9a-f]{64}$",
      "description": "Cross-DB dedupe spine (§5.5). Emitted ONLY on public records; omit on non-public."
    },
    "incident_dedupe_key_hmac": {
      "type": "string",
      "pattern": "^hmac-sha256:[0-9a-f]{64}$",
      "description": "Keyed variant for redacted-subject dedupe; pepper held by the §5.3 resolver."
    },
    "severity_vector": {
      "$ref": "severity_vector.schema.json",
      "description": "Recomputable ACEF-SEV:1.0 vector (§5.4). Companion grammar referenced, not inlined: delegates to severity_vector.schema.json, whose top-level is a string validator carrying the FULL mandatory Group-I sequence (HT/HG/RV/SC/BR in fixed order) plus the optional T/E/S metrics. The previous weak `^ACEF-SEV:1\\.0/` prefix admitted HG-less/unbandable vectors; the `$ref` rejects them so the card enforces bandability. The coarse `severity` enum MUST equal band(severity_vector).",
      "$comment": "Delegated to severity_vector.schema.json (§5.4: companion grammar referenced, not inlined). A present-but-unparseable or HG-less vector is rejected here via the companion's mandatory-Group-I pattern (raises ACEF-082 at validate time, §7)."
    },
    "sector_of_deployment": {
      "type": "object",
      "additionalProperties": false,
      "required": [
        "scheme",
        "code"
      ],
      "properties": {
        "scheme": {
          "enum": [
            "isic-rev4",
            "other"
          ]
        },
        "code": {
          "type": "string"
        }
      }
    },
    "harm_distribution_basis": {
      "type": "array",
      "items": {
        "type": "string",
        "enum": [
          "race",
          "sex",
          "national_origin",
          "disability",
          "religion",
          "sexual_orientation_or_gender_identity",
          "financial_means",
          "age",
          "geography",
          "ideology",
          "familial_status",
          "other"
        ]
      },
      "description": "Closed CSETv1 axis (§5.2). GDPR Art.9 special-category; §5.11 governs publishability (regulator-only by default; a *_commitment field carries the hash-committed form)."
    },
    "taxonomy_crosswalk": {
      "$ref": "taxonomy_crosswalk.schema.json",
      "description": "Closed, version-pinned members; derived projections of harm_core (§5.5)."
    },
    "coordinated_disclosure": {
      "$ref": "coordinated_disclosure.schema.json",
      "description": "Single canonical shape (§5.6)."
    },
    "transferability": {
      "type": "object",
      "additionalProperties": false,
      "properties": {
        "affects_other_models": {
          "type": "boolean"
        },
        "scope_note": {
          "type": "string"
        },
        "related_incident_ids": {
          "type": "array",
          "items": {
            "type": "string"
          }
        }
      }
    },
    "declared_publication_basis": {
      "type": "object",
      "additionalProperties": false,
      "description": "Declared (not adjudicated) basis required before publishing special-category/identifying fields (§5.11).",
      "properties": {
        "art6_basis": {
          "type": "string",
          "enum": [
            "consent",
            "contract",
            "legal_obligation",
            "vital_interests",
            "public_task",
            "legitimate_interests"
          ],
          "description": "GDPR Art. 6(1)(a)-(f)."
        },
        "art9_condition": {
          "type": "string",
          "enum": [
            "explicit_consent",
            "employment_social_security",
            "vital_interests",
            "not_for_profit_body",
            "made_public_by_data_subject",
            "legal_claims",
            "substantial_public_interest",
            "health_social_care",
            "public_health",
            "archiving_research_statistics"
          ],
          "description": "GDPR Art. 9(2)(a)-(j)."
        },
        "anonymization_method": {
          "type": "string"
        }
      },
      "anyOf": [
        {
          "required": [
            "art6_basis",
            "art9_condition"
          ]
        },
        {
          "required": [
            "anonymization_method"
          ]
        }
      ]
    }
  },
  "patternProperties": {
    "^[a-z0-9_]+_commitment$": {
      "type": "string",
      "pattern": "^sha256:[0-9a-f]{64}$",
      "description": "Hash-committed projection of a non-public source field (§5.11), e.g. description_commitment, harm_distribution_basis_commitment. Value MUST equal 'sha256:' + hex(SHA-256(JCS(source_value))) at the source path whose §5.11 disposition is hash-committed (commitment-linkage; orphan/mismatch raises ACEF-086)."
    },
    "^x-[a-z0-9-]+(/[a-z0-9-]+)*$": {
      "type": "object",
      "description": "X6 vendor-extension namespace (§5.5 / Appendix E Q15). Accepts both the bare `x-<vendor>` form and the slash-qualified namespace form `x-<vendor>/<segment>(/<segment>)*` documented in the repo (e.g. x-freddy and x-freddy/voice-rubric-emission, as cited in v1.1/manifest.schema.json:95 and present in tests/conformance/golden-bundles/). Segments are lowercase [a-z0-9-]; uppercase keys, non-`x-` keys, and a bare trailing slash (x-freddy/) are rejected. Any matching `x-*` key is accepted, safely-ignorable, preserved on round-trip, and MUST NOT affect conformance. Non-`x-`, non-`_commitment` unknown top-level keys remain rejected by additionalProperties: false."
    }
  },
  "additionalProperties": false
}
