{
  "public_incident_id": "AIIC-OPENAI-2026-0123456789ABCDEFGHJKMNPQRS",
  "id_grade": "self-asserted",
  "harm_core": {
    "realization": "harm_event",
    "causality": {
      "entity": "ai",
      "intent": "unintentional",
      "timing": "post_deployment"
    },
    "harm_class": "physical_health"
  },
  "taxonomy_crosswalk": {
    "eu_ai_act": {
      "edition": "reg-2024-1689",
      "serious_incident_triggers": ["3.49.a", "3.49.b"],
      "widespread": false,
      "death_involved": true
    }
  }
}
